SWIFT CODE;NAME;ADDRESS
WARTPLPWXXX;TOWARZYSTWO UBEZPIECZEN I REASEKURACJI WARTA SPOLKA AKCYJNA;RONDO I. DASZYNSKIEGO 1  WARSZAWA, MAZOWIECKIE, 00-843
AVCABGS1XXX;TRADING 212;LACHEZAR STANCHEV STR 3 LITEX TOWER, FLOOR 10 SOFIA, SOFIA, 1756
BICYBGS1XXX;LENNO GLOBAL ADVISORY JSC;OBORISHTE STR 9  SOFIA, SOFIA, 1504
BUTKBGS1XXX;UP TREND;ZLATEN ROG STREET 12  SOFIA, SOFIA, 1407
CAIJBGS1XXX;CAPITAL INVEST JSC;STEFAN KARADJA 2  SOFIA, SOFIA, 1000
EEERBGS1XXX;FH EVER INC.;LACHEZAR STANCHEV STR 3 LITEX TOWER, FLOOR 13 SOFIA, SOFIA, 1756
NEVACLR1XXX;NEVASA S.A CORREDORES DE BOLSA;ROSARIO NORTE 555, FLOOR 15 LAS CONDES - SANTIAGO, PROVINCIA DE SANTIAGO, 8320000
TBIEBGS1XXX;TBI INVEST EAD;TINTYAVA STR 13B IZTOK RESIDENTIAL COMPLEX, ENT A, FLOOR 2 SOFIA, SOFIA, 1113
EKIRPLPDXXX;KRAJOWA IZBA ROZLICZENIOWA S.A. (KIR S.A.);RTM. W. PILECKIEGO 65  WARSZAWA, MAZOWIECKIE, 02-781
MBBPPLPWXXX;MERCEDES-BENZ BANK POLSKA S.A.;GOTTLIEBA DAIMLERA 1  WARSZAWA, MAZOWIECKIE, 02-460
STVVBGS1XXX;STANDARD INVESTMENT;KOZYAK STREET 2 BLOCK 29, ENTRANCE B, OFFICE 4 SOFIA, SOFIA, 1408
VOWAPLP9XXX;VOLKSWAGEN BANK GMBH SP.Z O.O. ODDZIAL W POLSCE;RONDO ONZ 1  WARSZAWA, MAZOWIECKIE, 00-124
AVFIBGS1XXX;AVC FINANCE PLC;BUL. TODOR ALEKSANDROV 141 FLOOR 9 SOFIA, SOFIA, 1309
EFTGMTM1XXX;EFT GLOBAL LIMITED;PALAZZO PIETRO STIGES 103 STRAIT STREET VALLETTA, VALLETTA, VLT 1436
LKJFLV21XXX;LTFJA KKS JURNIEKU FORUMS;KATRINAS DAMBIS 22A  RIGA, RIGA, LV-1045
FIRYBGS1XXX;FH FINA-S AD;TSAR BORIS THE THIRD BULVD 159  SOFIA, SOFIA, 1618
BPABCLRMXXX;BANCO BTG PACTUAL CHILE;AVENIDA COSTANERA SUR 2730, P.19 PARQUE TITANIUM, TORRE B, LAS SANTIAGO, PROVINCIA DE SANTIAGO
TROMPLP1XXX;TRIGON DOM MAKLERSKI S.A.;MOGILSKA 65  KRAKOW, MALOPOLSKIE, 31-545
CITCMTMTXXX;CITCO CUSTODY LIMITED;LEVEL 2 WEST, MERCURY TOWER ELIA ZAMMIT STREET - ST. JULIAN'S, ST JULIAN'S, STJ 3155
TCBOCLR1XXX;TANNER CORREDORES DE BOLSA;EL GOLF 40, FLOOR 9 LAS CONDES SANTIAGO, PROVINCIA DE SANTIAGO 8320000
LPITCLR1XXX;LATCAM PAGOS INTERNACIONALES S.A.;  
AAMJBGS1XXX;ACTIVA ASSET MANAGEMENT JSC;CHRISTOPHER COLUMBUS BLVD 43 FLOOR 5 SOFIA, SOFIA, 1592
AMNMBGS1XXX;EF ASSET MANAGEMENT;HRISTOFOR KOLUMB  SOFIA, SOFIA, 1592
BCBDCLR1XXX;BBVA CORREDORES DE BOLSA LIMITADA;PEDRO DE VALDIVIA 100, FLOOR 7 PROVIDENCIA - SANTIAGO, PROVINCIA DE SANTIAGO, 8320000
BPBIBGSFISD;EUROBANK BULGARIA AD;  SOFIA, SOFIA
KACABGS1XXX;KAROLL CAPITAL MANAGEMENT;HRISTO BOTEV BLVD 57  SOFIA, SOFIA, 1303
POZNPLP1XXX;VOLKSWAGEN POZNAN SPOLKA Z OGRANICZONA ODPOWIEDZIALNOSCIA;UL. WARSZAWSKA 349  POZNAN, WIELKOPOLSKIE, 61-057
SKSMBGS1XXX;SKY ASSET MANAGEMENT;EKZARH YOSIF STR 31  SOFIA, SOFIA, 1000
STANALT1ELX;BANK OF ALBANIA;  ELBASAN, ELBASAN, 3001
STANALT1GJX;BANK OF ALBANIA;  GJIROKASTER, GJIROKASTER, 6001
STANALT1KOX;BANK OF ALBANIA;  KORCE, KORCE, 7000
STANALT1LUX;BANK OF ALBANIA;  LUSHNJE, FIER, 9001
STANALT1SHX;BANK OF ALBANIA;  SHKODER, SHKODER, 4001
STANALT1SPX;BANK OF ALBANIA;  TIRANA, TIRANA, 1001
TASGBGS1XXX;TBI ASSET MANAGEMENT EAD;TINTYAVA STR 13B IZTOK RESIDENTIAL COMPLEX, ENT A, FLOOR 2 SOFIA, SOFIA, 1113
UGMJBG21XXX;UG MARKET FUND MANAGEMENT JSC;VASIL APRILOV STR 92  PLOVDIV, PLOVDIV, 4000
ZAFIBG21XXX;ZAGORA FINACORP AD;DOBRUDJA STR. 10 ENTR. B, OFFICE 27 HASKOVO, HASKOVO, 6300
BATSALT1XXX;BRITISH AMERICAN TOBACCO - ALBANIA SH.P.K.;ISH KOMBINATI USHQIMOR KAVAJA STREET TIRANA, TIRANA, 1001
CITIPLPXCCH;BANK HANDLOWY W WARSZAWIE SA;  WARSZAWA, MAZOWIECKIE
CNAEBGS1XXX;CONCORD ASSET MANAGEMENT;TODOR ALEXANDROV BLVD 141  SOFIA, SOFIA, 1309
COIJBGS1XXX;COMPASS INVEST JSC;GEORGE WASHINGTON 19  SOFIA, SOFIA, 1000
CPSMBGS1XXX;CAPMAN ASSET MANAGEMENT JSC;TRI USHI STR 8  SOFIA, SOFIA, 1301
CSMEBGS1XXX;CCB ASSETS MANAGEMENT EAD;STEFAN KARADZHA 2  SOFIA, SOFIA, 1000
EAMGBGS1XXX;EXPAT ASSET MANAGEMENT;G.S. RAKOVSKI STR 96A  SOFIA, SOFIA, 1000
EUOBCLR1XXX;EUROAMERICA CORREDORES DE BOLSA S.A;APOQUINDO 3885 LAS CONDES SANTIAGO, PROVINCIA DE SANTIAGO 7550177
FFAMBGS1XXX;FFBH ASSET MANAGEMENT;ENOS STREET 2 FLOOR 4 SOFIA, SOFIA, 1408
INCJBGS1XXX;INVEST CAPITAL JSC;STEFAN KARADJA STREET 2  SOFIA, SOFIA, 1000
LACBLV2XCCB;BANK OF LATVIA;K. VALDEMARA STREET 2A  RIGA, RIGA, LV-1050
MCDABGS1XXX;MANAGEMENT COMPANY DSK ASSET MANAGEMENT AD;TZAR KALOYAN  SOFIA, SOFIA, 1000
RFAABG21XXX;REAL FINANCE ASSET MANAGEMENT;ALEXANDER S. PUSHKIN 24  VARNA, VARNA, 9002
SATGBGS1XXX;STRATEGY ASSET MANAGEMENT JSC;ST. TODOR ALEXANDROV 141  SOFIA, SOFIA, 1309
SATTBGS1XXX;SELECT ASSET MANAGMENT;BULGARIA BLVD 58  SOFIA, SOFIA, 1680
TESMBGS1XXX;TEXIM ASSET MANAGEMENT;TODOR ALEXANDROV BLVD 141  SOFIA, SOFIA, 1309
UBATBGS1XXX;UBB ASSET MANAGEMENT;SVETA SOFIA STR 5  SOFIA, SOFIA, 1000
ZLLCBGS1XXX;GOLDEN LION CAPITAL;POSTOYANSTVO  SOFIA, SOFIA, 1111
ELFGBGS1XXX;ELANA FUND MANAGEMENT;LACHEZAR STANCHEV STR 5 SOPHARMA BUSINESS TOWERS SOFIA, SOFIA, 1756
MUAABGS1XXX;MUNICIPAL BANK ASSET MANAGEMENT;VRABCHA 10  SOFIA, SOFIA, 1000
AGRKMTMTXXX;LIDION BANK PLC;  LUQA, LUQA, LQA 4000
ABIGBGS1XXX;AUSTRIAN BULGARIAN INVESTMENT GROUP AD;DAMYAN GRUEV 46  SOFIA, SOFIA, 1606
AFSMMTM1XXX;AMICORP FUND SERVICES MALTA LIMITED;FLOOR 1, BLUE HARBOUR BUSINESS CENTRE YACHT MARINA TA'XBIEX, TA'XBIEX, XBX 1027
VAFEBG21XXX;VARCHEV FINANCE EOOD;VLADISLAV VARNENCHIK BLVD 186 FLOOR 3, OFFICE 4.035 VARNA, VARNA, 9000
VMCEBG21XXX;VARCHEV MANAGING COMPANY EAD;VLADISLAV VARNENCHIK BLVD 186 FLOOR 3, OFFICE 4.035 VARNA, VARNA, 9009
CPSCMTM1XXX;A3E CAPITAL SICAV P.L.C.;FLOOR 1, ORANGE POINT DUN KARM STREET BIRKIRKARA, BIRKIRKARA, BKR 9037
MALTMTMTGCP;CENTRAL BANK OF MALTA;  VALLETTA, VALLETTA
SKOKPLPWXXX;KRAJOWA SPOLDZIELCZA KASA OSZCZEDNOSCIOWO-KREDYTOWA;WLADYSLAWA IV 22  SOPOT, POMORSKIE, 81-743
DOIIPLP1XXX;VESTOR DOM MAKLERSKI S.A.;ZEBRA TOWER MOKOTOWSKA 1 WARSZAWA, MAZOWIECKIE, 00-640
ICDGCLR1XXX;ITAU CHILE ADMINISTRADORA GENERAL DE FONDOS S.A.;  
UBPGMCMXXXX;UNION BANCAIRE PRIVEE, UBP SA;LA BELLE EPOQUE 17 AVENUE D'OSTENDE MONACO, MONACO, 98000
ACFCMTM1XXX;AMAGIS CAPITAL FUNDS SICAV PLC;184 ST. LUCIA STREET  VALLETTA, VALLETTA, VLT 1189
ALFPLV21XXX;ALFAPAY;KR. VALDEMARA IELA  RIGA, RIGA, LV-1013
CDERCLRMXXX;COMDER CONTRAPARTE CENTRAL S.A.;CERRO COLORADO 5240, FLOOR 18 EDIFICIO TORRES DEL PARQUE 1 SANTIAGO, PROVINCIA DE SANTIAGO
MIPYMTM1ALL;MISTRAL PAY LTD;  VALLETTA, VALLETTA
MIPYMTM1XXX;MISTRAL PAY LTD;EUROPA CENTRE 51 ST. ANNE STREET FLORIANA, IL-FURJANA, FRN 9011
LATSLV21XXX;E LATS, SIA;BAUSKAS STR. 20  RIGA, RIGA, LV-1004
BERLMCMCBDF;EDMOND DE ROTHSCHILD-MONACO;  MONACO, MONACO, 98000
AAAJBG21XXX;ARCUS ASSET MANAGEMENT JSC;6TH OF SEPTEMBER BLVD 152 BUSINESS CENTER LEGIS PLOVDIV, PLOVDIV, 4000
CEPAMCM1XXX;CAISSE D'EPARGNE ET DE PREVOYANCE COTE D'AZUR - AGENCE DE MONACO;17 BOULEVARD ALBERT PREMIER  MONACO, MONACO, 98000
RZBMMTM1XXX;RAIFFEISEN MALTA BANK PLC;IL-PIAZZETTA 52 TOWER ROAD SLIEMA, SLIEMA, SLM 1607
KRSPPLP2XXX;KRAKOWSKI BANK SPOLDZIELCZY;RYNEK KLEPARSKI 8  KRAKOW, MALOPOLSKIE, 31-150
BREXPLPWOMB;MBANK S.A. (FORMERLY BRE BANK S.A.);PILSUDSKIEGO STR 3  LODZ, LODZKIE, 90-368
WOSILV21XXX;WOT, SIA;MASKAVAS STR. 240-3  RIGA, RIGA, LV-1063
EUOTPLP1XXX;EURORATING SP. Z O.O.;CYNAMONOWA 19  WARSZAWA, MAZOWIECKIE, 02-777
ITAUCLRMSSO;BANCO ITAU CHILE;  
PMMCMCMCXXX;PACIFIC MANAGEMENT SAM;7 RUE DU GABIAN  MONACO, MONACO, 98000
TGAFMTM1XXX;TGA FUNDS SICAV PLC;FLOOR 3 BREWERY STREET BIRKIRKARA, BIRKIRKARA, BKR 3000
ECMBMTMTXXX;ECCM BANK PLC;THE ADELAIDE 230-231 TOWER ROAD SLIEMA, SLIEMA, SLM 1601
CDERCLRGXXX;COMDER CONTRAPARTE CENTRAL S.A.;CERRO COLORADO 5240, FLOOR 18 TORRES DEL PARQUE I - SANTIAGO PROVINCIA DE SANTIAGO, 7560591
CRXBMTMTXXX;CREDORAX BANK LIMITED;PALAZZO HOMEDES 80 STRAIT STREET VALLETTA, VALLETTA, VLT 1436
PYMXMTMTXXX;FINANCE INCORPORATED LIMITED;FLOOR 2, CAPITAL BUSINESS CENTRE BLOCK A TRIQ TAZ- ZWEJT SAN GWANN, SAN GWANN, SGN 3000
VAFRMTM1XXX;BOV FUND SERVICES LIMITED;FLOOR 3 TRIQ IL-BIRRERIJA MRIEHEL, BIRKIRKARA , BKR 3000
WBKPPLP1CCP;SANTANDER BANK POLSKA S.A. (FORMERLY BANK ZACHODNI WBK S.A.);  WROCLAW, DOLNOSLASKIE
AXERMTM1XXX;AXERIA RE LIMITED;108 TRIQ IT TIBEN  SWIEQI, SWIEQI, SWQ 3032
BIGKLV21XXX;BIGBANK AS LATVIJAS FILIALE;GUSTAVA ZEMGALA GATVE 78-1  RIGA, RIGA, LV-1039
BPKHPLPGXXX;PKO BANK HIPOTECZNY SA;PULAWSKA 15  WARSZAWA, MAZOWIECKIE, 02-515
IVFMBGS1XXX;INVEST FUND MANAGEMENT;DOBRUDJA 6  SOFIA, SOFIA, 1000
FEMAMTMTXXX;MULTITUDE BANK P.L.C.;FLOOR 9, ST BUSINESS CENTRE 120 THE STRAND GZIRA, GZIRA, GZR 1027
KCCPPLPWASI;KDPW CCP;  WARSZAWA, MAZOWIECKIE
EISIMTM1XXX;EIGER SICAV PLC;FLOOR 3, VALLETTA BUILDING 1 SOUTH STREET VALLETTA, VALLETTA, VLT 1103
APMEMTM1XXX;APRIL MEDITERRANEAN LIMITED;FLOOR 2, PROGETTA HOUSE TOWER ROAD SWATAR BIRKIRKARA, BIRKIRKARA, BKR 4012
CINKPLPZXXX;CINKCIARZ.PL SP. Z O.O.;WROCLAWSKA 17B  ZIELONA GORA, WIELKOPOLSKIE, 65-427
RTLDMCMCXXX;ROTHELAND S.A.M.;4-6 RUELLE SAINTE DEVOTE  MONACO, MONACO, 98000
AAVLCLR9XXX;AFEX AGENTES DE VALORES LIMITADA;  
DIETMCMCXXX;DIETSMANN MONTE CARLO SAM;GILDO PASTOR CENTER 7, 9 RUE DU GABIAN MONACO, MONACO, 98000
SIAILV21XXX;STEITS, SIA;MASKAVAS STR. 240  RIGA, RIGA, LV-1063
RAMUBGS1XXX;RAIFFEISEN ASSET MANAGEMENT (BULGARIA) EAD;VAPTZAROV BLVD, PHASE2 NIKOLA I 55 BUSINESS CENTER EXPO 2000 SOFIA, SOFIA, 1407
AAESBGS1XXX;ASTRA ASSET MANAGEMENT JSC;SREDNA GORA STR 49 FLOOR 6 SOFIA, SOFIA, 1303
DEUTPL21XXX;DEUTSCHE BANK POLSKA S.A;ALEJA ARMII LUDOWEJ 26  WARSZAWA, MAZOWIECKIE, 00-609
RATIPLP1XXX;INC RATING SP. Z O.O.;KRASINSKIEGO 16  POZNAN, WIELKOPOLSKIE, 60-830
AAAPBGS1XXX;ALARIC CAPITAL;EXARCH YOSIF 7  SOFIA, SOFIA, 1301
FNEXBGS1XXX;GRAND CAPITAL LTD;ALEXANDER STAMBOLIJSKI BLVD 235  SOFIA, SOFIA, 1303
CONPPLPWXXX;CONOTOXIA SP. Z O.O.;WROCLAWSKA 17B  ZIELONA GORA, WIELKOPOLSKIE, 65-427
TESTBGS1XXX;TREND ASSET MANAGEMENT;AKSAKOV 28  SOFIA, SOFIA, 1000
TGAFMTM1001;TGA FUNDS SICAV PLC;  MRIEHEL, BIRKIRKARA
TGAFMTM1002;TGA FUNDS SICAV PLC;  MRIEHEL, BIRKIRKARA
TGAFMTM1003;TGA FUNDS SICAV PLC;  MRIEHEL, BIRKIRKARA
BCECCLB1XXX;BANCO CENTRAL DE CHILE;  
NIXGLV21XXX;NIXGROUP;MASKAVAS 240-3  RIGA, RIGA, LV-1063
PCBCCLRMXXX;CHINA CONSTRUCTION BANK,  AGENCIA EN CHILE;  
MFCBMTMSXXX;MERKANTI BANK LIMITED;  ST. JULIAN'S, STJ 3140
PCBCCLRMCLR;CHINA CONSTRUCTION BANK,  AGENCIA EN CHILE;  
PESIMTM1XXX;PERSYSTEMCY SICAV PLC;FLOOR 1 SQAQ IL-FAWWARA SLIEMA, SLIEMA, SLM 1670
RECVMTM1XXX;REDHEDGE SICAV PLC;SUITE 2, FLOOR 3 1 BREWERY STREET MRIEHEL, BIRKIRKARA , BKR 3000
AUSVMTM1XXX;AURORA SICAV PLC;VALLETTA BUILDINGS SOUTH STREET VALLETTA, VALLETTA, VLT 1103
RECVMTM1001;REDHEDGE SICAV PLC;SUITE 2, FLOOR 3 1 BREWERY STREET MRIEHEL, BIRKIRKARA , BKR 3000
SPBOPLPWXXX;BANK SPOLDZIELCZY W BRODNICY;KAMIONKA 27  - BRODNICA KUJAWSKO-POMORSKIE, 87-300 
BCECCLC1XXX;BANCO CENTRAL DE CHILE;  
OPAYLV21XXX;XOPAY, SIA;REPUBLIKAS LAUKUMS 3 - 107  RIGA, RIGA, LV-1010
ASFHPLPKXXX;AMER SPORTS GLOBAL BUSINESS SERVICES SP. Z O.O.;ZABLOCIE 43B  KRAKOW, MALOPOLSKIE, 30-701
SBMTMTMTXXX;SPARKASSE BANK MALTA PLC;TOWNSQUARE 101 TRIQ IX XATT TA QUI SI SANA SLIEMA, SLIEMA, SLM 3112
HFSIMTM1XXX;HEKA FUNDS SICAV PLC;FLOOR 3 BREWERY STREET MRIEHEL, BIRKIRKARA , BKR 3000
MZNSMTM1XXX;M.Z. INVESTMENT SERVICES LIMITED;MZ HOUSE 55 ST RITA STREET RABAT, RABAT, RBT 1523
NESBPLPWFMB;NEST BANK S.A.;SOLEC 38  WARSZAWA, MAZOWIECKIE, 00-394
NESBPLPWXXX;NEST BANK S.A.;UL. WOLOSKA 24  WARSZAWA, MAZOWIECKIE, 02-675
NBPLPLPWSEA;NARODOWY BANK POLSKI;SWIETOKRZYSKA 11-21  WARSZAWA, MAZOWIECKIE, 00-919
NBPLPLPWSEB;NARODOWY BANK POLSKI;SWIETOKRZYSKA 11-21  WARSZAWA, MAZOWIECKIE, 00-919
MOXSLV21XXX;MONEY EXPRESS SIA;LACPLESA STREET 88  RIGA, RIGA, LV-1003
PAYELV21XXX;PAYSERA LT;ZEMGALU IELA 23A - 19  RIGA, RIGA, LV-1006
WCORMTMQXXX;WEBCOR INVESTMENTS LTD;FJVA BUSINESS CENTRE B2 INDUSTRY STREET, ZONE 5, CENTRAL BUSINESS QORMI, QORMI, CBD 5030
PCBCPLPWXXX;CHINA CONSTRUCTION BANK(EUROPE)WARSAW BRANCH;WARSAW FINANCIAL CENTER UL.EMILII PLATER 53, FLOOR 15 WARSZAWA, MAZOWIECKIE, 00-113
DEEABGS1XXX;SMART FUND ASSET MANAGEMENT;TSAR OSVOBODITEL BLVD 8 FLOOR 4 SOFIA, SOFIA, 1000
BPKOPLPWSEC;PKO BANK POLSKI S.A.;  WARSZAWA, MAZOWIECKIE
ENGAPLP1XXX;ENGLAND.PL SP. Z O.O.;UL. MARSZALKA JOZEFA PILSUDSKIEG 45  - KOSZALIN, ZACHODNIOPOMORSKIE 75-502
EUFVMTM1XXX;EUROCHANGE FINANCIAL SERVICES LTD;175 RUE D'ARGENS  GZIRA, GZIRA, GZR 1362
NBPLPLPWCRD;NARODOWY BANK POLSKI;SWIETOKRZYSKA 11-21  WARSZAWA, MAZOWIECKIE, 00-919
PATCBGSFXXX;PAYNETICS AD;JAMES BOURCHIER 76A HILL TOWER 1 SOFIA, SOFIA, 1407
STANALTSXXX;BANK OF ALBANIA;SHESHI SKENDERBEJ 1  TIRANA, TIRANA, 1001
GASIPLP1XXX;GALPERIN SOLUTION LIMITED LIABILITY COMPANY;ROZANA 2/51  WARSZAWA, MAZOWIECKIE, 02-548
SIAFLV21XXX;SIA PAYBANCO;BALASTA DAMBIS 70-6  RIGA, RIGA, LV-1048
IPAGPLPLXXX;IPAGOO LLP, SPOLKA PARTNERSKA ODDZIAL;HENRYKA SIENKIEWICZA 82/84, FLOOR 3  LODZ, LODZKIE, 90-318
EMONMTM2XXX;EMONEY PLC;TRIQ IX XATT TA' XBIEX  MSIDA, MSIDA, MSD 1516
LACBLV2XAMS;BANK OF LATVIA;K. VALDEMARA STREET 2A  RIGA, RIGA, LV-1050
PTFIPLPWXXX;PKO TOWARZYSTWO FUNDUSZY INWESTYCYJNYCH SA;UL CHLODNA 52  WARSZAWA, MAZOWIECKIE, 00-872
BREXPLPWMDM;MBANK S.A. (FORMERLY BRE BANK S.A.);WSPOLNA 47/49  WARSZAWA, MAZOWIECKIE, 00-684
CBCUUYMMGPA;BANCO CENTRAL DEL URUGUAY;FLORIDA PAYSANDU MONTEVIDEO, MONTEVIDEO, 11000
CCUHMTMTXXX;MONEYBASE;FLOOR GF, EWROPA BUSINESS CENTRE TRIQ DUN KARM BIRKIRKARA, BIRKIRKARA, BKR 9034
PTFIPLPWAAP;PKO TOWARZYSTWO FUNDUSZY INWESTYCYJNYCH SA;UL CHLODNA 52  WARSZAWA, MAZOWIECKIE, 00-872
PTFIPLPWADG;PKO TOWARZYSTWO FUNDUSZY INWESTYCYJNYCH SA;UL CHLODNA 52  WARSZAWA, MAZOWIECKIE, 00-872
PTFIPLPWAMS;PKO TOWARZYSTWO FUNDUSZY INWESTYCYJNYCH SA;UL CHLODNA 52  WARSZAWA, MAZOWIECKIE, 00-872
PTFIPLPWARA;PKO TOWARZYSTWO FUNDUSZY INWESTYCYJNYCH SA;UL CHLODNA 52  WARSZAWA, MAZOWIECKIE, 00-872
PTFIPLPWARE;PKO TOWARZYSTWO FUNDUSZY INWESTYCYJNYCH SA;UL CHLODNA 52  WARSZAWA, MAZOWIECKIE, 00-872
PTFIPLPWARJ;PKO TOWARZYSTWO FUNDUSZY INWESTYCYJNYCH SA;UL CHLODNA 52  WARSZAWA, MAZOWIECKIE, 00-872
PTFIPLPWARW;PKO TOWARZYSTWO FUNDUSZY INWESTYCYJNYCH SA;UL CHLODNA 52  WARSZAWA, MAZOWIECKIE, 00-872
PTFIPLPWARZ;PKO TOWARZYSTWO FUNDUSZY INWESTYCYJNYCH SA;UL CHLODNA 52  WARSZAWA, MAZOWIECKIE, 00-872
PTFIPLPWASZ;PKO TOWARZYSTWO FUNDUSZY INWESTYCYJNYCH SA;UL CHLODNA 52  WARSZAWA, MAZOWIECKIE, 00-872
PTFIPLPWDUS;PKO TOWARZYSTWO FUNDUSZY INWESTYCYJNYCH SA;UL CHLODNA 52  WARSZAWA, MAZOWIECKIE, 00-872
PTFIPLPWECH;PKO TOWARZYSTWO FUNDUSZY INWESTYCYJNYCH SA;UL CHLODNA 52  WARSZAWA, MAZOWIECKIE, 00-872
PTFIPLPWEWZ;PKO TOWARZYSTWO FUNDUSZY INWESTYCYJNYCH SA;UL CHLODNA 52  WARSZAWA, MAZOWIECKIE, 00-872
PTFIPLPWFAP;PKO TOWARZYSTWO FUNDUSZY INWESTYCYJNYCH SA;UL CHLODNA 52  WARSZAWA, MAZOWIECKIE, 00-872
PTFIPLPWFBL;PKO TOWARZYSTWO FUNDUSZY INWESTYCYJNYCH SA;UL CHLODNA 52  WARSZAWA, MAZOWIECKIE, 00-872
PTFIPLPWFDL;PKO TOWARZYSTWO FUNDUSZY INWESTYCYJNYCH SA;UL CHLODNA 52  WARSZAWA, MAZOWIECKIE, 00-872
PTFIPLPWFGD;PKO TOWARZYSTWO FUNDUSZY INWESTYCYJNYCH SA;UL CHLODNA 52  WARSZAWA, MAZOWIECKIE, 00-872
PTFIPLPWFGM;PKO TOWARZYSTWO FUNDUSZY INWESTYCYJNYCH SA;UL CHLODNA 52  WARSZAWA, MAZOWIECKIE, 00-872
PTFIPLPWFGS;PKO TOWARZYSTWO FUNDUSZY INWESTYCYJNYCH SA;UL CHLODNA 52  WARSZAWA, MAZOWIECKIE, 00-872
PTFIPLPWFIB;PKO TOWARZYSTWO FUNDUSZY INWESTYCYJNYCH SA;UL CHLODNA 52  WARSZAWA, MAZOWIECKIE, 00-872
PTFIPLPWFMS;PKO TOWARZYSTWO FUNDUSZY INWESTYCYJNYCH SA;UL CHLODNA 52  WARSZAWA, MAZOWIECKIE, 00-872
PTFIPLPWFOD;PKO TOWARZYSTWO FUNDUSZY INWESTYCYJNYCH SA;UL CHLODNA 52  WARSZAWA, MAZOWIECKIE, 00-872
PTFIPLPWFSK;PKO TOWARZYSTWO FUNDUSZY INWESTYCYJNYCH SA;UL CHLODNA 52  WARSZAWA, MAZOWIECKIE, 00-872
PTFIPLPWFSW;PKO TOWARZYSTWO FUNDUSZY INWESTYCYJNYCH SA;UL CHLODNA 52  WARSZAWA, MAZOWIECKIE, 00-872
PTFIPLPWMDG;PKO TOWARZYSTWO FUNDUSZY INWESTYCYJNYCH SA;UL CHLODNA 52  WARSZAWA, MAZOWIECKIE, 00-872
PTFIPLPWSUR;PKO TOWARZYSTWO FUNDUSZY INWESTYCYJNYCH SA;UL CHLODNA 52  WARSZAWA, MAZOWIECKIE, 00-872
TRIVBGS1XXX;TRANSCARD FINANCIAL SERVICES;CHERNI VRAH BLVD 43  SOFIA, SOFIA, 1407
PTFIPLPWE20;PKO TOWARZYSTWO FUNDUSZY INWESTYCYJNYCH SA;UL CHLODNA 52  WARSZAWA, MAZOWIECKIE, 00-872
PTFIPLPWE30;PKO TOWARZYSTWO FUNDUSZY INWESTYCYJNYCH SA;UL CHLODNA 52  WARSZAWA, MAZOWIECKIE, 00-872
PTFIPLPWE40;PKO TOWARZYSTWO FUNDUSZY INWESTYCYJNYCH SA;UL CHLODNA 52  WARSZAWA, MAZOWIECKIE, 00-872
PTFIPLPWE50;PKO TOWARZYSTWO FUNDUSZY INWESTYCYJNYCH SA;UL CHLODNA 52  WARSZAWA, MAZOWIECKIE, 00-872
PTFIPLPWE60;PKO TOWARZYSTWO FUNDUSZY INWESTYCYJNYCH SA;UL CHLODNA 52  WARSZAWA, MAZOWIECKIE, 00-872
PTFIPLPWFOW;PKO TOWARZYSTWO FUNDUSZY INWESTYCYJNYCH SA;UL CHLODNA 52  WARSZAWA, MAZOWIECKIE, 00-872
PTFIPLPWFSD;PKO TOWARZYSTWO FUNDUSZY INWESTYCYJNYCH SA;UL CHLODNA 52  WARSZAWA, MAZOWIECKIE, 00-872
PTFIPLPWFSO;PKO TOWARZYSTWO FUNDUSZY INWESTYCYJNYCH SA;UL CHLODNA 52  WARSZAWA, MAZOWIECKIE, 00-872
PTFIPLPWSIG;PKO TOWARZYSTWO FUNDUSZY INWESTYCYJNYCH SA;UL CHLODNA 52  WARSZAWA, MAZOWIECKIE, 00-872
MTCCMTMTXXX;MTACC LIMITED;ST JULIANS BUSINESS CENTRE 2 ELIA ZAMMIT STREET - ST. JULIAN'S, ST JULIAN'S, STJ 3155
BKCHCLRMXXX;BANK OF CHINA, AGENCIA EN CHILE;AVENIDA ANDRES BELLO 2457, FLOOR 16 COSTANERA CENTER TORRE DOS SANTIAGO, PROVINCIA DE SANTIAGO
EBPAPLP1XXX;EBURY PARTNERS UK LIMITED;UL KROLEWSKA 18  WARSZAWA, MAZOWIECKIE, 00-103
BEHMMCMCXXX;BESINS HEALTHCARE MONACO SAM;LOT 777 , FLOOR RDC, LES TERRASSES DU PORT 2 AVENUE DES LIGURES MONACO, MONACO, 98000
PTFIPLPWBUR;PKO TOWARZYSTWO FUNDUSZY INWESTYCYJNYCH SA;UL CHLODNA 52  WARSZAWA, MAZOWIECKIE, 00-872
PTFIPLPWDIA;PKO TOWARZYSTWO FUNDUSZY INWESTYCYJNYCH SA;UL CHLODNA 52  WARSZAWA, MAZOWIECKIE, 00-872
PTFIPLPWRUB;PKO TOWARZYSTWO FUNDUSZY INWESTYCYJNYCH SA;UL CHLODNA 52  WARSZAWA, MAZOWIECKIE, 00-872
PTFIPLPWSZA;PKO TOWARZYSTWO FUNDUSZY INWESTYCYJNYCH SA;UL CHLODNA 52  WARSZAWA, MAZOWIECKIE, 00-872
PTFIPLPWSZM;PKO TOWARZYSTWO FUNDUSZY INWESTYCYJNYCH SA;UL CHLODNA 52  WARSZAWA, MAZOWIECKIE, 00-872
BCHICLRMCUS;BANCO DE CHILE;  
ESPYBGS1XXX;EASYPAY AD;IVAN VAZOV STR 16  SOFIA, SOFIA, 1000
PHPYMTM1XXX;PHOENIX PAYMENTS LTD;SOUTH STREET  VALLETTA, VALLETTA, VLT 1103
TRUDBG21XXX;TRANSACT EUROPE EAD;KARNIGRADSKA 19  SOFIA, SOFIA, 1000
IGTRPLP1XXX;IGORIA TRADE S.A.;PULAWSKA 111A-109, FLOOR 5  WARSZAWA, MAZOWIECKIE, 02-707
AIZKLV22CLN;ABLV BANK, AS IN LIQUIDATION;ELIZABETES STREET 23  RIGA, RIGA, LV-1010
IESCMTM1XXX;4 SQ INTERNATIONAL SCC LTD;OFFICE NO. 9 152 NAXXAR ROAD SAN GWANN, SAINT JOHN, SGN 9030
PAPYMTMTXXX;PAPAYA LTD;31 SLIEMA ROAD  GZIRA, GZIRA, GZR 1637
ENLCCLRMXXX;ENEL CHILE S.A.;AVENIDA SANTA ROSA 76, FLOOR 15 EDIFICIO ENEL - SANTIAGO, PROVINCIA DE SANTIAGO, 8330099
PTFIPLPWAKG;PKO TOWARZYSTWO FUNDUSZY INWESTYCYJNYCH SA;UL CHLODNA 52  WARSZAWA, MAZOWIECKIE, 00-872
PTFIPLPWAKT;PKO TOWARZYSTWO FUNDUSZY INWESTYCYJNYCH SA;UL CHLODNA 52  WARSZAWA, MAZOWIECKIE, 00-872
PTFIPLPWALF;PKO TOWARZYSTWO FUNDUSZY INWESTYCYJNYCH SA;UL CHLODNA 52  WARSZAWA, MAZOWIECKIE, 00-872
PTFIPLPWALS;PKO TOWARZYSTWO FUNDUSZY INWESTYCYJNYCH SA;UL CHLODNA 52  WARSZAWA, MAZOWIECKIE, 00-872
PTFIPLPWDEL;PKO TOWARZYSTWO FUNDUSZY INWESTYCYJNYCH SA;UL CHLODNA 52  WARSZAWA, MAZOWIECKIE, 00-872
PTFIPLPWGAM;PKO TOWARZYSTWO FUNDUSZY INWESTYCYJNYCH SA;UL CHLODNA 52  WARSZAWA, MAZOWIECKIE, 00-872
PTFIPLPWNED;PKO TOWARZYSTWO FUNDUSZY INWESTYCYJNYCH SA;UL CHLODNA 52  WARSZAWA, MAZOWIECKIE, 00-872
PTFIPLPWOGL;PKO TOWARZYSTWO FUNDUSZY INWESTYCYJNYCH SA;UL CHLODNA 52  WARSZAWA, MAZOWIECKIE, 00-872
PTFIPLPWOKP;PKO TOWARZYSTWO FUNDUSZY INWESTYCYJNYCH SA;UL CHLODNA 52  WARSZAWA, MAZOWIECKIE, 00-872
PTFIPLPWPAK;PKO TOWARZYSTWO FUNDUSZY INWESTYCYJNYCH SA;UL CHLODNA 52  WARSZAWA, MAZOWIECKIE, 00-872
PTFIPLPWPAS;PKO TOWARZYSTWO FUNDUSZY INWESTYCYJNYCH SA;UL CHLODNA 52  WARSZAWA, MAZOWIECKIE, 00-872
PTFIPLPWPOB;PKO TOWARZYSTWO FUNDUSZY INWESTYCYJNYCH SA;UL CHLODNA 52  WARSZAWA, MAZOWIECKIE, 00-872
PTFIPLPWPPI;PKO TOWARZYSTWO FUNDUSZY INWESTYCYJNYCH SA;UL CHLODNA 52  WARSZAWA, MAZOWIECKIE, 00-872
UBPGMCMXT2S;UNION BANCAIRE PRIVEE, UBP SA;LA BELLE EPOQUE 17 AVENUE D'OSTENDE MONACO, MONACO, 98000
LLBBLV2X111;SIGNET BANK AS;ANTONIJAS 3  RIGA, RIGA, LV-1010
MSFVMTM1XXX;CEEVO FINANCIAL SERVICES (MALTA) LIMITED;SUITE 2 , FLOOR 2, SKYWAY OFFICES BLOCK B 178 MARINA STREET PIETA, PIETA, PTA 9042
PAUUMTM1XXX;FINXP LIMITED;SUITE 3, FLOOR 2, SKYWAY OFFICES BLOCK A 177 MARINA STREET PIETA, PIETA, PTA 9072
SIMZLV21XXX;SIA MONETIZATOR;BLAUMANA STR. 5A-10  RIGA, RIGA, LV-1011
BREXPLPWWA5;MBANK S.A. (FORMERLY BRE BANK S.A.);PROSTA 68  WARSZAWA, MAZOWIECKIE, 00-838
EUFCBGS1XXX;EURO-FINANCE LTD;PATRIARCH EVTIMII BLVD 84  SOFIA, SOFIA, 1463
TRPEMTM1XXX;TRUEVO PAYMENTS LTD;FLOOR 1, MWH BUILDING ORATORY STREET NAXXAR, NAXXAR, NXR 2504
CFTEMTM1XXX;OPENPAYD FINANCIAL SERVICES MALTA LTD;FLOOR 3 137 SPINOLA ROAD - ST JULIAN'S, ST. JULIAN'S, STJ 3155 
DOAEMTM1XXX;DOLFIN ASSET SERVICES LIMITED;FLOOR 5 89 ST. JOHN'S STREET VALLETTA, VALLETTA, VLT 1165
CHASCLRMAMM;JPMORGAN CHASE BANK, N.A., SANTIAGO BRANCH;AV. APOQUINDO 2827, FLOOR 13 LAS CONDES - SANTIAGO, PROVINCIA DE SANTIAGO, 7590956
CHASCLRMCDB;JPMORGAN CHASE BANK, N.A., SANTIAGO BRANCH;AV. APOQUINDO 2827, FLOOR 13 LAS CONDES - SANTIAGO, PROVINCIA DE SANTIAGO, 7590956
CHASCLRMICM;JPMORGAN CHASE BANK, N.A., SANTIAGO BRANCH;AV. APOQUINDO 2827, FLOOR 13 LAS CONDES - SANTIAGO, PROVINCIA DE SANTIAGO, 7590956
PTFIPLPWFSF;PKO TOWARZYSTWO FUNDUSZY INWESTYCYJNYCH SA;UL CHLODNA 52  WARSZAWA, MAZOWIECKIE, 00-872
PTFIPLPWFSS;PKO TOWARZYSTWO FUNDUSZY INWESTYCYJNYCH SA;UL CHLODNA 52  WARSZAWA, MAZOWIECKIE, 00-872
GSCLCLR1XXX;GOLDMAN SACHS CHILE LIMITADA;AVENIDA APOQUINDO 472, 3 PATIO FOSTER BUILDING, LAS CONDES SANTIAGO, PROVINCIA DE SANTIAGO
GSIWPLP1XXX;GOLDMAN SACHS INTERNATIONAL WARSAW BRANCH;WARSAW SPIRE PLAC EUROPEJSKI 1 WARSZAWA, MAZOWIECKIE, 00-844
GSPSPLP1XXX;GOLDMAN SACHS POLAND SERVICES SPOLKA Z OGRANICZONA ODPOWIEDZ;WARSAW SPIRE PLAC EUROPEJSKI 1 WARSZAWA, MAZOWIECKIE, 00-844
UNOGMTM1XXX;UNIONGOLDENPAY LTD;FLAT 12, REGENT HOUSE BISAZZA STREET SLIEMA, SLIEMA, SLM 1640
XPATBGSFXXX;EXPAT ASSET MANAGEMENT EAD;GEORGI RAKOVSKI STR 96A  SOFIA, SOFIA, 1000
CNENPLP1XXX;CURRENCY ONE S.A.;SZYPERSKA 14, FLOOR V  POZNAN, WIELKOPOLSKIE, 61-754
SRZKPLPKXXX;BANK SPOLDZIELCZY RZEMIOSLA W KRAKOWIE;DUNAJEWSKIEGO 7  KRAKOW, MALOPOLSKIE, 31-133
AUFCMTM1XXX;AQA UCITS FUNDS SICAV PLC;TRIQ DUN KARM  BIRKIRKARA, BIRKIRKARA, BKR 9034
LSAVUYM1XXX;LATIN SECURITIES SA AGENTE DE VALORES;RUTA 8 KM 17 500 OF 215 FLOOR 2 MONTEVIDEO, MONTEVIDEO, 11000
VGAGBGSFXXX;VARENGOLD BANK AG, SOFIA BRANCH;CHRISTOPHER COLUMBUS BLVD 43 FLOOR 9 SOFIA, SOFIA, 1521
APAYMTMTXXX;TRUST PAYMENTS (MALTA) LTD;EUROPA BUSINESS CENTRE 2 1 TRIQ DUN KARM BIRKIRKARA, BIRKIRKARA, BKR 9034
PTFIPLPWSGM;PKO TOWARZYSTWO FUNDUSZY INWESTYCYJNYCH SA;UL CHLODNA 52  WARSZAWA, MAZOWIECKIE, 00-872
FINDMTMTXXX;FINDUCTIVE LTD.;FLOOR 2, CENTRIS BUSINESS GATEWAY II 46 TRIQ IS-SALIB TAL-IMRIEHEL BIRKIRKARA, BIRKIRKARA, CBD 3020
GSESMTMTXXX;GLOBAL SHARES EXECUTION SERVICES LIMITED;171 OLD BAKERY STREET  VALLETTA, VALLETTA, VLT 1455
PTFIPLPWAMM;PKO TOWARZYSTWO FUNDUSZY INWESTYCYJNYCH SA;UL CHLODNA 52  WARSZAWA, MAZOWIECKIE, 00-872
PTFIPLPWP25;PKO TOWARZYSTWO FUNDUSZY INWESTYCYJNYCH SA;UL CHLODNA 52  WARSZAWA, MAZOWIECKIE, 00-872
PTFIPLPWP30;PKO TOWARZYSTWO FUNDUSZY INWESTYCYJNYCH SA;UL CHLODNA 52  WARSZAWA, MAZOWIECKIE, 00-872
PTFIPLPWP35;PKO TOWARZYSTWO FUNDUSZY INWESTYCYJNYCH SA;UL CHLODNA 52  WARSZAWA, MAZOWIECKIE, 00-872
PTFIPLPWP40;PKO TOWARZYSTWO FUNDUSZY INWESTYCYJNYCH SA;UL CHLODNA 52  WARSZAWA, MAZOWIECKIE, 00-872
PTFIPLPWP45;PKO TOWARZYSTWO FUNDUSZY INWESTYCYJNYCH SA;UL CHLODNA 52  WARSZAWA, MAZOWIECKIE, 00-872
PTFIPLPWP50;PKO TOWARZYSTWO FUNDUSZY INWESTYCYJNYCH SA;UL CHLODNA 52  WARSZAWA, MAZOWIECKIE, 00-872
PTFIPLPWP55;PKO TOWARZYSTWO FUNDUSZY INWESTYCYJNYCH SA;UL CHLODNA 52  WARSZAWA, MAZOWIECKIE, 00-872
PTFIPLPWP60;PKO TOWARZYSTWO FUNDUSZY INWESTYCYJNYCH SA;UL CHLODNA 52  WARSZAWA, MAZOWIECKIE, 00-872
VPAYPLP2XXX;VIVA PAYMENT SERVICES SPOLKA AKCYJNA ODDZIAL W POLSCE;VILLA METRO BUSINESS HOUSE 145 WARSZAWA, MAZOWIECKIE, 02-715
EKIRPLPWXXX;KRAJOWA IZBA ROZLICZENIOWA S.A. (KIR S.A.);PILECKIEGO ST. 65  WARSZAWA, MAZOWIECKIE, 02-781
INMKBGSSXXX;IP INTERCAPITAL MARKETS AD;GEORGI SAVA RAKOVSKI 140 FLOOR 6 SOFIA, SOFIA, 1000
RSTAALTTXXX;ALBANIAN SECURITIES REGISTER ALREG;AP 3, KATI 1, FLOOR 3 RRUGA NIKOLLA TUPE 1, NJESIA BASHKIAKE 5 TIRANA, TIRANA, 1001
FEMAMTMAXXX;MULTITUDE BANK P.L.C.;FLOOR 9, ST BUSINESS CENTRE 120 THE STRAND GZIRA, GZIRA, GZR 1027
TOFNPLPPXXX;TOWARZYSTWO FUNDUSZY INWESTYCYJNYCH PZU SA;PZU PARK RONDO IGNACEGO DASZYNSKIEGO 4 WARSZAWA, MAZOWIECKIE, 00-843
INGBPLPHXXX;ING BANK HIPOTECZNY S.A.;CHORZOWSKA 50  KATOWICE, SLASKIE, 40-101
PZUSPLPPXXX;POWSZECHNY ZAKLAD UBEZPIECZEN SPOLKA AKCYJNA;PZU PARK RONDO IGNACEGO DASZYNSKIEGO 4 WARSZAWA, MAZOWIECKIE, 00-843
PZUZPLPPXXX;POWSZECHNY ZAKLAD UBEZPIECZEN NA ZYCIE SPOLKA AKCYJNA;PZU PARK RONDO IGNACEGO DASZYNSKIEGO 4 WARSZAWA, MAZOWIECKIE, 00-843
SDBMMCM2XXX;SOCIETE GENERALE (FORMERLY SOCIETE DE BANQUE MONACO);LE PARK PALACE 27 AVENUE DE LA COSTA MONACO, MONACO, 98000
PCCACLRZXXX;COMBANC S.A.;  
PTFIPLPWFNK;PKO TOWARZYSTWO FUNDUSZY INWESTYCYJNYCH SA;UL CHLODNA 52  WARSZAWA, MAZOWIECKIE, 00-872
PTFIPLPWMER;PKO TOWARZYSTWO FUNDUSZY INWESTYCYJNYCH SA;UL CHLODNA 52  WARSZAWA, MAZOWIECKIE, 00-872
PICTMCMCXXX;BANK PICTET AND CIE (EUROPE) AG, SUCCURSALE DE MONACO;VILLA MIRAFLORES 2 AVENUE SAINT-MICHEL MONACO, MONACO, 98000
SBMMMCMCXXX;SOCIETE ANONYME DES BAINS DE MER ET DU CERCLE DES ETRANGERS A MONACO;PLACE DU CASINO  MONACO, MONACO, 98000
PABYMTM2XXX;PAYBYPAGO;FLOOR 2 14 VAULT, VALLETTA WATERFRONT BIRKIRKARA, BIRKIRKARA, BKR 4013
PTFIPLPWEOS;PKO TOWARZYSTWO FUNDUSZY INWESTYCYJNYCH SA;UL CHLODNA 52  WARSZAWA, MAZOWIECKIE, 00-872
PTFIPLPWOBG;PKO TOWARZYSTWO FUNDUSZY INWESTYCYJNYCH SA;UL CHLODNA 52  WARSZAWA, MAZOWIECKIE, 00-872
PTFIPLPWORP;PKO TOWARZYSTWO FUNDUSZY INWESTYCYJNYCH SA;UL CHLODNA 52  WARSZAWA, MAZOWIECKIE, 00-872
ITHOMTM2XXX;A2A INTERNATIONAL HOLDINGS LIMITED;VILLA MALITAH MEDITERRANEAN STREET ST. JULIAN'S, ST. JULIAN'S, STJ 3155
MBWMMTMT010;MEDIRECT BANK (MALTA) PLC;FLOOR 1, THE CENTRE TIGNE POINT SLIEMA, SLIEMA, TPO 0001
