SWIFT CODE;NAME;ADDRESS
FRIPCLR1XXX;FITCH CHILE CLASIFICADORA DE REISGO LTD;ALCANTARA 200, OF. 202 LAS CONDES SANTIAGO, PROVINCIA DE SANTIAGO 8320000
FRIPPLP1XXX;FITCH POLSKA SA;SASKI CRESCENT KROLEWSKA 16 WARSZAWA, MAZOWIECKIE, 00-103
FRIPUYM1XXX;FITCH URUGUAY CALIFICADORA RIESGO S.A.;CONVENCION 1490 AP. 201 MONTEVIDEO, MONTEVIDEO, 11100
FTLNCLRMXXX;TANNER SERVICIOS FINANCIEROS S.A.;  
FTRMMTM1XXX;FINCO TREASURY MANAGEMENT LIMITED;FLOOR 2, THE MALL COMPLEX  FLORIANA, IL-FURJANA, FRN 1470
GASBPLP1XXX;BANK SPOLDZIELCZY W GASOCINIE;UL.GLOWNA 23  GASOCIN, MAZOWIECKIE, 06-440
GBGCPLPKXXX;VELOBANK S.A.;THE WARSAW HUB RONDO I. DASZYNSKIEGO 2C WARSZAWA, MAZOWIECKIE, 00-843
GBWCPLPPXXX;SGB-BANK S.A. (FORMERLY GOSPODARCZY BANK WIELKOPOLSKI S.A.);UL. SZARYCH SZEREGOW 23A  POZNAN, WIELKOPOLSKIE, 60-462
GLFAMTM1XXX;GLOBALCAPITAL FINANCIAL MANAGEMENT LIMITED;120 THE STRAND  GZIRA, GZIRA, GZR 1027
GLFMMTM1XXX;GLOBALCAPITAL FINANCIAL MANAGEMENT LIMITED;OPERATIONS CENTRE BALZAN VALLEY ROAD BALZAN, BALZAN, BZN 1407
GLMKBGS1XXX;GLOBAL MARKETS;  SOFIA, SOFIA, 1816
GOSKPLPWXXX;BANK GOSPODARSTWA KRAJOWEGO;AL. JEROZOLIMSKIE 7  WARSZAWA, MAZOWIECKIE, 00-496
GROIMTM1XXX;GROWTH INVESTMENTS LIMITED;MIDDLE SEA HOUSE  FLORIANA, IL-FURJANA, FRN 1442
HABALV22XXX;SWEDBANK AS;BALASTA DAMBIS 1A  RIGA, RIGA, LV-1048
HAJNPLP1XXX;BANK SPOLDZIELCZY W HAJNOWCE;PILSUDSKIEGO 12  HAJNOWKA, PODLASKIE, 17-200
HANDPLPWXXX;SVENSKA HANDELSBANKEN AB SPOLKA AKCYJNA ODDZIAL W POLSCE;WOLOSKA 22  WARSZAWA, MAZOWIECKIE, 02-675
HOCIMTM1XXX;HOGG CAPITAL INVESTMENTS LIMITED;SUITE 33, REGENT HOUSE BISAZZA STREET SLIEMA, SLIEMA, SLM 1640
HSBCPLPWXXX;HSBC CONTINENTAL EUROPE (SA) ODDZIAL W POLSCE;RONDO ONZ 1  WARSZAWA, MAZOWIECKIE, 00-124
HSFMMTM1XXX;HSBC GLOBAL ASSET MANAGEMENT (MALTA) LIMITED;HEXAGON HOUSE SPENCER GARDENS BLATA IL-BAJDA, BLATA IL-BAJDA, BKR 3000
HYVEPLP2XXX;PEKAO BANK HIPOTECZNY SA;RENAISSANCE TOWER UL. SKIERNIEWICKA 10A WARSZAWA, MAZOWIECKIE, 01-230
IABGBGSFXXX;INTERNATIONAL ASSET BANK AD;TODOR ALEXANDROV BLVD 81-83  SOFIA, SOFIA, 1303
IAFAUYM1XXX;INTEGRACION A.F.A.P. S.A.;BVAR ARTIGAS 1253  MONTEVIDEO, MONTEVIDEO, 11200
IARUAWA1XXX;INTERBANK ARUBA NV;CAYA G.F. CROES 38  - ORANJESTAD ORANJESTAD-WEST AND ORANJESTAD-EAST 
ICCSCLR1XXX;ITAU CORPBANCA CORREDORES DE BOLSA S.A.;APOQUINDO 3457, FLOOR 1 EDIFICIO ITAU - SANTIAGO, PROVINCIA DE SANTIAGO, 8320000
ICPLPLP1XXX;INTERBANK FINANCIAL SERVICES SP. Z O.O.;SIENNA 73  WARSZAWA, MAZOWIECKIE, 00-833
IDMAPLP1XXX;VESTOR DOM MAKLERSKI S.A.;BUKOWIECKA 92  WARSZAWA, MAZOWIECKIE, 03-893
IIGBMTMTXXX;IIG BANK (MALTA) LTD;PORTOMASO BUSINESS TOWER PORTOMASO ST. JULIAN'S, ST. JULIAN'S, STJ 4011
IIMPPLP1XXX;NN INVESTMENT PARTNERS TOWARZYSTWO FUNDUSZY INWESTYCYJNYCH SPOLKA AKCYJNA;HOLLAND PARK PLAC TRZECH KRZYZY 10/14 WARSZAWA, MAZOWIECKIE, 00-499
IMIEAWA1XXX;IMTRADEX INTERNATIONAL N.V.;TANKI LENDEERT 143  - ORANJESTAD ORANJESTAD-WEST AND ORANJESTAD-EAST 
INGBBGSFXXX;ING BANK N.V. SOFIA BRANCH;BULGARIA BLVD 49B  SOFIA, SOFIA, 1404
INGBPLPWXXX;ING BANK SLASKI SA;UL. SOKOLSKA 34  KATOWICE, SLASKIE, 40-086
INTFBGSFXXX;ICARD AD;BUSINESS PARK VARNA B1  VARNA, VARNA, 9009
INUXUYM1XXX;INDUMEX S.A.;RINCON 477  MONTEVIDEO, MONTEVIDEO, 11000
IORTBGSFXXX;INVESTBANK JSC;BULGARIA BLVD 85  SOFIA, SOFIA, 1404
IPSEPLP1XXX;IPOPEMA SECURITIES S.A.;PROZNA 9  WARSZAWA, MAZOWIECKIE, 00-017
ITAUCLRMXXX;BANCO ITAU CHILE;PRESIDENTE RIESCO 5537, FLOOR 7 EDIFICIO NUEVA LAS CONDES, LAS SANTIAGO, PROVINCIA DE SANTIAGO
ITAUUYMMXXX;BANCO ITAU;DR. LUIS BONAVITA 1266  MONTEVIDEO, MONTEVIDEO, 11300
ITFIPLP1XXX;NN INVESTMENT PARTNERS TOWARZYSTWO FUNDUSZY INWESTYCYJNYCH SPOLKA AKCYJNA;HOLLAND PARK PLAC TRZECH KRZYZY 10/14 WARSZAWA, MAZOWIECKIE, 00-499
IVSEPLPPXXX;PLUS BANK S.A.;AL. STANOW ZJEDNOCZONYCH 61A  WARSZAWA, MAZOWIECKIE, 04-028
IZOLMTMTXXX;IZOLA BANK PLC;53-58 EAST STREET  VALLETTA, VALLETTA, VLT 1251
JMFSMTM1XXX;JESMOND MIZZI FINANCIAL SERVICES LIMITED;FLAT 3 67 SOUTH STREET VALLETTA, VALLETTA, VLT 1105
JSSILV21XXX;DUKASCOPY EUROPE IBS AS;LACPLESA 20A-1  RIGA, RIGA, LV-1011
KBLXMCMCXXX;BANQUE RICHELIEU MONACO;BRETAGNE 8 AVENUE DE GRANDE BRETAGNE MONACO, MONACO, 98005
KDPWPLPAXXX;NATIONAL DEPOSITORY FOR SECURITIES (KDPW SA);CENTRUM GIELDOWE KSIAZECA 4 WARSZAWA, MAZOWIECKIE, 00-498
KDPWPLPWXXX;KDPW S.A.;UL. KSIAZECA 4  WARSZAWA, MAZOWIECKIE, 00-498
KKSDLV21XXX;LATVIJAS ARODBIEDRIBU KRAJAIZDEVU SABIEDRIBA;TURGENEVA 14  RIGA, RIGA, LV-1050
KLESPLP1XXX;BANK SPOLDZIELCZY W KLESZCZOWIE;UL.GLOWNA 114  KLESZCZOW, LODZKIE, 97-410
KOPWPLP1KPW;KOMPANIA PIWOWARSKA S.A.;  POZNAN, WIELKOPOLSKIE
KOPWPLP1XXX;KOMPANIA PIWOWARSKA S.A.;UL. SZWAJCARSKA  POZNAN, WIELKOPOLSKIE, 61-285
KRSPPLPKXXX;KRAKOWSKI BANK SPOLDZIELCZY;RYNEK KLEPARSKI 8  KRAKOW, MALOPOLSKIE, 31-150
LACBLV2XXXX;BANK OF LATVIA;K. VALDEMARA STREET 2A  RIGA, RIGA, LV-1050
LAPBLV2XXXX;AS MAGNETIQ BANK;BRIVIBAS IELA 54  RIGA, RIGA, LV-1011
LARVCLR1XXX;LARRAIN VIAL;  
LBMAMTMTXXX;LOMBARD BANK MALTA PLC;LOMBARD HOUSE 67 REPUBLIC STREET VALLETTA, VALLETTA, VLT 1117
LCDELV22XXX;NASDAQ CSD SE;VALNU STREET 1  RIGA, RIGA, LV-1050
LFIKLV21XXX;AKCIJU SABIEDRIBA 'LATGALES FINANSU KOMPANIJA';KR. BARONA STREET 20/22 - 5  REZEKNE, REZEKNE, LV-4601
LIPNPLP1XXX;BANK SPOLDZIELCZY W LIPNIE;MICKIEWICZA 30A  LIPNO, POWIAT LIPNOWSKI, 87-600
LMARUYM1XXX;ALMAR S.A.;AV. 18 DE JULIO 1701  MONTEVIDEO, MONTEVIDEO, 11200
LPNSLV21XXX;STATE JOINT STOCK COMPANY LATVIJAS PASTS;LIDOSTA ZIEMELU IELA 10 RIGA, RIGA, LV-1053
LUMIBGS1XXX;BANK LEUMI ROMANIA-SOFIA BRANCH;POSITANO STREET 9 ENTRANCE A SOFIA, SOFIA, 1000
MAEAMCM1XXX;BANQUE MARTIN MAUREL;3 BOULEVARD PRINCESSE CHARLOTTE  MONACO, MONACO, 98003
MALTMTMTXXX;CENTRAL BANK OF MALTA;CASTILLE PLACE  VALLETTA, VALLETTA, VLT 1063
MBCBCLR1XXX;MBI CORREDORES DE BOLSA S.A.;AV. PRESIDENTE RIESCO 5711, OF 602 EDIFICIO HUIDOBRO - SANTIAGO PROVINCIA DE SANTIAGO, 8320000
MBWMMTMTXXX;MEDIRECT BANK (MALTA) PLC;FLOOR 1, THE CENTRE TIGNE POINT SLIEMA, SLIEMA, TPO 0001
MDMZPLP1XXX;MERCURIUS DOM MAKLERSKI SP. Z.O.O.;UL. SMIALA 26  WARSZAWA, MAZOWIECKIE, 01-523
MDOMPLP1XXX;MILLENNIUM DOM MAKLERSKI S.A.;MILLENNIUM PLAZA AL. JEROZOLIMSKIE 123 A WARSZAWA, MAZOWIECKIE, 02-017
MGFIMTM1XXX;MICHAEL GRECH FINANCIAL INVESTMENT SERVICES LIMITED;MICAN COURT 1 J.F. KENNEDY SQUARE, GOZO VICTORIA, GOZO, VCT 2580
MGRZPLP1XXX;BANK SPOLDZIELCZY W PRZYSUSZE;UL.GRODZKA 3  PRZYSUCHA, POWIAT PRZYSUSKI, 26-400
MHBFPLPWXXX;DNB BANK POLSKA S.A.;CROWN SQUARE PRZYOKOPOWA 31, FLOOR 9 WARSZAWA, MAZOWIECKIE, 01-208
MIFBALTRXXX;MINISTRY OF FINANCE OF ALBANIA;BLVD DESHMORET E KOMBIT 3  TIRANA, TIRANA, 1001
MLOBCLR1XXX;MERRILL LYNCH CORREDORES DE BOLSA S.A.;AV APOQUINDO 3500, FLOOR 9 LAS CONDES - SANTIAGO, PROVINCIA DE SANTIAGO, 8320000
MMEBMTM10M2;HSBC BANK MALTA P.L.C.;  QORMI, QORMI
MMEBMTMTXXX;HSBC BANK MALTA P.L.C.;116 ARCHBISHOP STREET  VALLETTA, VALLETTA, VLT 1444
MMSEMCM1XXX;ROTHSCHILD AND CO WEALTH MANAGEMENT MONACO;VILLA LA MADONE 11 BOULEVARD DES MOULINS MONACO, MONACO, 98000
MNEXCLRMXXX;BANCO CONSORCIO;AV EL BOSQUE SUR 130, FLOOR 7 CONSORCIO, LAS CONDES - SANTIAGO PROVINCIA DE SANTIAGO, 8320000
MSZCPLP1XXX;BANK SPOLDZIELCZY W MSZCZONOWIE;UL.WARSZAWSKA 5  MSZCZONOW, MAZOWIECKIE, 96-320
MULTLV2XXXX;AS INDUSTRA BANK;MUITAS IELA 1  RIGA, RIGA, LV-1010
NACNUYMMXXX;BANCO DE LA NACION ARGENTINA;JUAN CARLOS GOMEZ 1372  MONTEVIDEO, MONTEVIDEO, 11000
NASBBGSFXXX;BULGARIAN DEVELOPMENT BANK EAD;DYAKON IGNATIY STREET 1  SOFIA, SOFIA, 1000
NBPLPLPDXXX;NARODOWY BANK POLSKI;UL. SWIETOKRZYSKA 11/21  WARSZAWA, MAZOWIECKIE, 00-919
NBPLPLPWBAN;NARODOWY BANK POLSKI;  WARSZAWA, MAZOWIECKIE
NBPLPLPWKIR;NARODOWY BANK POLSKI;  WARSZAWA, MAZOWIECKIE
NBPLPLPWXXX;NARODOWY BANK POLSKI;SWIETOKRZYSKA 11-21  WARSZAWA, MAZOWIECKIE, 00-919
NCBAALTXXXX;BANKA KOMBETARE TREGTARE SH.A.;RRUGA E VILAVE, LUNDER 1  TIRANA, TIRANA, 1045
NORDMCM1XXX;CREDIT DU NORD;27 AVENUE DE LA COSTA  MONACO, MONACO, 98001
NOSWPLP1XXX;BANK SPOLDZIELCZY W NOWYM STAWIE;RYNEK PULASKIEGO 2  NOWY STAW, POMORSKIE, 82-230
ODMSPLP1XXX;OPERA DOM MAKLERSKI SPOWKA Z OGRANICZONA ODPOWIEDZIALNOSCIA;RONDO ONZ 1  WARSZAWA, MAZOWIECKIE, 00-124
OKBALV21XXX;OGRES KOMERCBANKA;E. BIRZNIEKA UPISHA STR. 12  RIGA, RIGA, LV-1050
OSTRPLP1XXX;BANK SPOLDZIELCZY W BRODNICY;UL.KILINSKIEGO 42  OSTROLEKA, MAZOWIECKIE, 07-410
PAEXLV21XXX;CITADELE BANKA, AKCIJU SABIEDRIBA;REPUBLIKAS SQUARE 2A  RIGA, RIGA, LV-1522
PAMBPLP1XXX;POLISH-AMERICAN MORTGAGE BANK INC.;UL KROLEWSKA 27  WARSZAWA, MAZOWIECKIE, 00-060
PARBPLPXXXX;BNP PARIBAS SECURITIES POLAND;UL. WRONIA 31  WARSZAWA, MAZOWIECKIE, 00-846
PARXLV22XXX;JSC CITADELE BANKA;REPUBLIKAS LAUKUMS 2A  RIGA, RIGA, LV-1010
PBSTPLP1XXX;POWIATOWY BANK SPOLDZIELCZY W TOMASZOWIE MAZOWIECKIM;PL.KAZIMIERZA WLK. 7  INOWLODZ, LODZKIE, 97-215
PCCACLRMXXX;COMBANC S.A.;CERRO COLORADO 5240, FLOOR 8 TORRE DEL PARQUE II - SANTIAGO, PROVINCIA DE SANTIAGO, 7560995
PDKFMTM1XXX;PDK FINANCIAL SERVICES LIMITED;ST. GEORGES ROAD  - ST. JULIAN'S ST. JULIAN'S, STJ 3208 
PKOPPLPWCUS;BANK POLSKA KASA OPIEKI SA - BANK PEKAO SA;ZUBRA 1, FLOOR 9  WARSZAWA, MAZOWIECKIE, 01-066
PKOPPLPWKRA;BANK POLSKA KASA OPIEKI SA - BANK PEKAO SA;JOSEPHA CONRADA STR 37  KRAKOW, MALOPOLSKIE, 31-357
PKOPPLPWXXX;BANK POLSKA KASA OPIEKI SA - BANK PEKAO SA;ZUBRA 1  WARSZAWA, WARSZAWA, 01-066
POCZPLP4XXX;POCZTOWY BANK SA;JAGIELLONSKA 17  - BYDGOSZCZ KUJAWSKO-POMORSKIE, 85-959 
PODSPLP1XXX;PODKARPACKI BANK SPOLDZIELCZY;UL. KOSCIUSZKI 22  SANOK, PODKARPACKIE, 38-500
POLUPLPRXXX;BANK POLSKIEJ SPOLDZIELCZOSCI SPOLKA AKCYJNA;UL. GRZYBOWSKA 81  WARSZAWA, MAZOWIECKIE, 00-844
POPOPLP1XXX;POCZTA POLSKA SPOLKA AKCYJNA;UL. RAKOWIECKA 26  WARSZAWA, MAZOWIECKIE, 00-940
POROPLP1XXX;THE POLISH REGISTRY OF ALLOWANCES;KRUCZA 5/11D  WARSZAWA, MAZOWIECKIE, 00-548
POSDPLP1XXX;POWIATOWY BANK SPOLDZIELCZY W KEDZIERZYNIE-KOZLU;UL. RYNEK 6A  - KEDZIERZYN-KOZLE POWIAT KEDZIERZYNSKO-KOZIELSKI 47-200
POSOMCM1XXX;BANCA POPOLARE DI SONDRIO (SUISSE) SA;3 RUE PRINCESSE FLORESTINE  MONACO, MONACO, 98011
PPABPLPKXXX;BNP PARIBAS BANK POLSKA S.A.;KASPRZAKA STREET 2  WARSZAWA, MAZOWIECKIE, 01-211
PRBACLR1XXX;BANCO DE LA PROVINCIA DE BUENOS AIRES;  
PRBAUYMMXXX;PROVINCIA CASA FINANCIERA;L A. DE HERRERA 1248 WORLD TRADE CENTER TORRE II, OF. 111 MONTEVIDEO, MONTEVIDEO, 13000
PRCBBGSFXXX;PROCREDIT BANK (BULGARIA) EAD;TODOR ALEXANDROV BLVD 26  SOFIA, SOFIA, 1303
PSATPLPWXXX;PROSERVICE FINTECO SP Z O.O.;KONSTRUKTORSKA 12A  WARSZAWA, MAZOWIECKIE, 02-673
PTFIPLP1XXX;PKO TOWARZYSTWO FUNDUSZY INWESTYCYJNYCH SA;UL GROJECKA 5  WARSZAWA, MAZOWIECKIE, 02-019
PUPPALTRXXX;BANKA OTP ALBANIA SH.A.;TWIN TOWERS 1ST TOWER BLVD.DESHMORET E KOMBIT TIRANA, TIRANA, 1010
PZUAPLP1XXX;PZU ASSET MANAGEMET SA;AL. JANA PAWLA II 24  WARSZAWA, MAZOWIECKIE, 00-133
RAFAUYM1XXX;REPUBLICA A.F.A.P. S.A.;18 DE JULIO 1883  MONTEVIDEO, MONTEVIDEO, 11200
RBTTAWAWXXX;RBC ROYAL BANK (ARUBA) N.V. (FORMERLY RBTT BANK ARUBA N.V.);ITALIESTRAAT 36  - ORANJESTAD ORANJESTAD-WEST AND ORANJESTAD-EAST 
REBCCLR1XXX;REDBANC S.A;  
RHBHPLPWXXX;MBANK HIPOTECZNY SA;PROSTA 18  WARSZAWA, MAZOWIECKIE, 00-850
RIBRLV22XXX;REGIONALA INVESTICIJU BANKA;J. ALUNANA 2  RIGA, RIGA, LV-1010
RIFSMTM1XXX;RIZZO FARRUGIA AND CO.(STOCKBROKERS) LIMITED;FLOOR 3, AIRWAYS HOUSE HIGH STREET SLIEMA, SLIEMA, SLM 1549
RIKOLV2XXXX;LUMINOR BANK AS LATVIAN BRANCH;SKANSTES STREET 12  RIGA, RIGA, LV-1013
RPLYCLRMXXX;BANCO RIPLEY;  
RTMBLV2XXXX;RIETUMU BANKA;VESETAS STREET 7  RIGA, RIGA, LV-1013
RTSXUYM1XXX;SISTEMA DE LIQUIDACION BRUTA EN TIEMPO REAL(LBTR);DIAGONAL FABINI 777  MONTEVIDEO, MONTEVIDEO, 11100
RZBBBGSFXXX;UNITED BULGARIAN BANK AD (FORMER KBC BANK BULGARIAEAD);VITOSHA BLVD. 89B MILLENNIUM CENTER SOFIA, SOFIA, 1463
SANMCLR1XXX;SANTANDER INVESTMENT S.A. CORREDORES DE BOLSA;BANDERA 140, FLOOR 16 LAS CONDES SANTIAGO, PROVINCIA DE SANTIAGO 8320000
SBELPLP1XXX;BANK SPOLDZIELCZY W BELCHATOWIE;UL.PILSUDSKIEGO 14  BELCHATOW, LODZKIE, 97-400
SBLEPLP1XXX;BRANIEWSKO - PASLECKI BANK SPOLDZIELCZY Z SIEDZIBAW PASLEKU;ZACISZE 14/16  ELBLAG, WARMINSKO-MAZURSKIE, 82-300
SCCUPLP1XXX;SANTANDER SECURITIES S.A.;FOCUS AL. ARMII LUDOWEJ 26 WARSZAWA, MAZOWIECKIE, 00-609
SECTCLR1850;SAMSUNG ELECTRONICS CHILE LIMITADA (LTDA);AVDA. AMERICO VESPUCIO SUR 100 OFICINA 102 LAS CONDES - SANTIAGO PROVINCIA DE SANTIAGO, 8320000
SECTCLR1XXX;SAMSUNG ELECTRONICS CHILE LIMITADA (LTDA);AVDA. AMERICO VESPUCIO SUR 100 OFICINA 102 LAS CONDES - SANTIAGO PROVINCIA DE SANTIAGO, 8320000
SECTLV21961;SAMSUNG ELECTRONICS BALTICS;FLOOR 6 DUNTES IELA 6 RIGA, RIGA, LV-1013
SECTLV21XXX;SAMSUNG ELECTRONICS BALTICS;FLOOR 6 DUNTES IELA 6 RIGA, RIGA, LV-1013
SECTPLP14D0;SAMSUNG ELECTRONICS POLSKA SPOLKA Z OGRANICZONA ODPOWIEDZIALNOSCIA;BUDYNEK UBC SZTURMOWA 442-742, 2A WARSZAWA, MAZOWIECKIE, 02-678
SECTPLP14N1;SAMSUNG ELECTRONICS POLSKA SPOLKA Z OGRANICZONA ODPOWIEDZIALNOSCIA;UL. MICKIEWICZA 52  WRONKI, WIELKOPOLSKIE, 64-510
SECTPLP1XXX;SAMSUNG ELECTRONICS POLSKA SPOLKA Z OGRANICZONA ODPOWIEDZIALNOSCIA;BUDYNEK UBC SZTURMOWA 442-742, 2A WARSZAWA, MAZOWIECKIE, 02-678
SEFMLV21XXX;SIA 'SEMFOPAY';DZIRNAVU STREET 57A-4  RIGA, RIGA, LV-1010
SESNPLP1XXX;SECUS ASSET MANAGEMENT SA;MILLENIUM PLAZA SOWINSKIEGO 46 KATOWICE, SLASKIE, 40-018
SEUAMCM1XXX;SECURITAS;ATHOS PALACE 2 RUE DE LA LUJERNETTA MONACO, MONACO, 98000
SGBTMCMCXXX;SOCIETE GENERALE PRIVATE BANKING (MONACO);IMMEUBLE LE REGINA 13-15 BOULEVARD DES MOULINS MONACO, MONACO, 98000
SGSBALTXXXX;RAIFFEISEN BANK SH.A.;RR 'DESHMORET E 4 SHKURTIT' 6  TIRANA, TIRANA, 1010
SGTMMCM1XXX;SOCIETE GENERALE PRIVATE BANKING (MONACO);13-15 BOULEVARD DES MOULINS  MONACO, MONACO, 98000
SHQHALT1XXX;POSTA SHQIPTARE SH.A.;POSTAVE DREJTORIA E PERGJITHSHME E RR.'RESHIT COLLAKU' 4 TIRANA, TIRANA, 1005
SKARPLP1XXX;BANK SPOLDZIELCZY W SKARYSZEWIE;UL.ZEROMSKIEGO 7A  SKARYSZEW, MAZOWIECKIE, 26-640
SLIPPLP1XXX;BANK SPOLDZIELCZY W LIPSKU;SANDOMIERSKA 8  LIPSKO, MAZOWIECKIE, 27-300
SMCTMCM1P02;SOCIETE MARSEILLAISE DE CREDIT;41 BD DES MOULINS  MONACO, MONACO, 98000
SMCTMCM1P04;SOCIETE MARSEILLAISE DE CREDIT;24 AV DE FONTVIEILLE  MONACO, MONACO, 98000
SMCTMCM1XXX;SOCIETE MARSEILLAISE DE CREDIT;45 RUE GRIMALDI  MONACO, MONACO, 98000
SOGEMCM1XXX;SOCIETE GENERALE MONTE CARLO (MONACO);PALAIS DE LA SCALA 16 AVENUE DE LA COSTA MONACO, MONACO, 98007
SOGEPLPWXXX;SOCIETE GENERALE SPOLKA AKCYJNA ODDZIAL W POLSCE;BUILDING B STUDIO OFFICE COMPLEX LUCKA STREET 9 WARSZAWA, MAZOWIECKIE, 00-842
SOMBBGSFXXX;MUNICIPAL BANK AD;VRABCHA STREET 6  SOFIA, SOFIA, 1000
SOPBPLP1XXX;BANK SPOLDZIELCZY TOWARZYSTWO OSZCZEDNOSCIOWO POZYCZKOWE PA CO BANK W PABIANICACH;UL.PULASKIEGO 8  PABIANICE, LODZKIE, 95-200
SPBNPLP1XXX;BANK SPOLDZIELCZY W BRANSKU;KOSCIUSZKI 2A  BRANSK, PODLASKIE, 17-120
SPBOPLP1XXX;BANK SPOLDZIELCZY W BRODNICY;KAMIONKA 27  - BRODNICA KUJAWSKO-POMORSKIE, 87-300 
SPCEPLP1XXX;BANK SPOWDZIELCZY W CZERSKU;UL. DR ZIELINSKIEGO 4  CZERSK, POMORSKIE, 89-650
SPCYPLP1XXX;BANK SPOLDZIELCZY W CHYNOWIE;CHYNOW 55 A  CHYNOW, POWIAT GROJECKI, 05-650
SPDDPLP1XXX;BANK SPOLDZIELCZY W KADZIDLE;KURPIOWSKA 10  KADZIDLO, POWIAT OSTROLECKI, 07-420
SPERPLP1XXX;BANK SPOLDZIELCZY W PRZEDBORZU;MOSTOWA 31  PRZEDBORZ, LODZKIE, 97-570
SPGBPLP1XXX;BANK SPOLDZIELCZY W GABINIE;DOBRZYKOWSKA 1  GABIN, MAZOWIECKIE, 09-530
SPGIPLP1XXX;BANK SPOLDZIELCZY W GLINOJECKU;UL.PLOCKA 14  GLINOJECK, MAZOWIECKIE, 06-450
SPHLPLP1XXX;BANK SPOLDZIELCZY W HALINOWIE;PILSUDSKIEGO 36  HALINOW, MAZOWIECKIE, 05-074
SPILPLP1XXX;BANK SPOLDZIELCZY W ILOWIE;UL. PLOCKA 4  ILOW, MAZOWIECKIE, 01-231
SPJEPLP1XXX;POLUDNIOWO-MAZOWIECKI BS W JEDLINSKU;WARECKA  JEDLINSK, SLASKIE, 26-660
SPMLPLP1XXX;BANK SPOLDZIELCZY W MALBORKU;MARCA 17, 32  MALBORK, POMORSKIE, 82-200
SPMPPLP1XXX;BANK SPOLDZIELCZY MAZOWSZE W PLOCKU;UL.WARMINSKA 12  PLOCK, MAZOWIECKIE, 09-408
SPNIPLP1XXX;BANK SPOLDZIELCZY W NASIELSKU;UL.KOSCIUSZKI 19  NASIELSK, MAZOWIECKIE, 05-190
SPOPPLP1XXX;BANK SPOLDZIELCZY W OPOCZNIE;PL.KOSCIUSZKI 3  OPOCZNO, LODZKIE, 26-300
SPPUPLP1XXX;BANK SPOLDZIELCZY W PULTUSKU;KOSCIUSZKI 1  PULTUSK, MAZOWIECKIE, 06-100
SPTOPLP1XXX;BANK SPOLDZIELCZY W TARNOBRZEGU;UL. SOKOLA 12  TARNOBRZEG, TARNOBRZEG, 39-400
SPWCPLP1XXX;BANK SPOLDZIELCZY W GLOWACZOWIE;BANKOWA 1  GLOWACZOW, MAZOWIECKIE, 26-903
SPWSPLP1XXX;BANK SPOLDZIELCZY W WISKITKACH;STRAZACKA 1  WISKITKI, MAZOWIECKIE, 96-315
SPYYPLP1XXX;KURPIOWSKI BANK SPOLDZIELCZY W MYSZYNCU;PLAC WOLNOSCI 56  - MYSZYNIEC POWIAT OSTROLECKI, 07-430 
SPZKPLP1XXX;BANK SPOLDZIELCZY RZEMIOSLA W KRAKOWIE;UL. DUNAJEWSKIEGO 7  KRAKOW, MALOPOLSKIE, 31-133
SPZOPLP1XXX;BANK SPOLDZIELCZY W ZWOLENIU;ALEJA JANA PAWLA II 25  ZWOLEN, MAZOWIECKIE, 26-700
SPZUPLP1XXX;BANK SPOLDZIELCZY W ZUROMINIE;PLAC WOLNOSCI 3  ZUROMIN, MAZOWIECKIE, 09-300
SSTYPLP1XXX;BANK SPOLDZIELCZY W STRYKOWIE;WARSZAWSKA 29  STRYKOW, POWIAT ZGIERSKI, 95-010
STANALTRXXX;BANK OF ALBANIA;SHESHI SKONDERBEJ 1  TIRANA, TIRANA, 1001
STIIPLP1XXX;BANK SPOLDZIELCZY W STAREJ BIALEJ;BIALA 24  STARA BIALA, MAZOWIECKIE, 09-411
STSABGSFXXX;DSK BANK (FORMERLY STATE SAVINGS BANK);MOSKOVSKA STREET 19  SOFIA, SOFIA, 1040
STSFBGS1XXX;BULBROKERS;CHERVENA STENA STR 1 FLOOR 2 OFFICE B-2, LOZENEC DISTRICT SOFIA, SOFIA, 1421
SURIUYMMXXX;BANQUE HERITAGE (URUGUAY) S.A.;RINCON 530  MONTEVIDEO, MONTEVIDEO, 11000
SUSRPLP1XXX;SUPREMA SECURITIES S.A.;CENTRUM JASNA JASNA 14/16A WARSZAWA, MAZOWIECKIE, 00-041
SZLLPLP1XXX;BANK SPOLDZIELCZY ZIEMI LECZYCKIEJ W LECZYCY;M.KONOPNICKIEJ 12  LECZYCA, LODZKIE, 99-100
SZTUPLP1XXX;VIENNA LIFE TOWARZYSTWO UBEZPIECZEN NA ZYCIE S.A. VIENNA INSURANCE GROUP;U.L. CYBERNETYKI 7  WARSZAWA, MAZOWIECKIE, 02-677
TBDMPLP1XXX;X-TRADE BROKERS DOM MAKLERSKI SPOWKA AKCYJNA;OGRODOWA STREET, CITY GATE 58, A FLOOR 12 WARSZAWA, MAZOWIECKIE, 00-786
TCZBBGSFXXX;T.C. ZIRAAT BANKASI - SOFIA BRANCH;TSAR SAMUIL STR. 87  SOFIA, SOFIA, 1000
TEGECLR1XXX;TESORERIA GENERAL DE LA REPUBLICA;  
TEXIBGSFXXX;TEXIM BANK AD;TODOR ALEXANDROV BLVD 117  SOFIA, SOFIA, 1303
TGBAMTMTXXX;GARANTI BANK, MALTA BRANCH;STRAND TOWERS 36 THE STRAND SLIEMA, SLIEMA, SLM 1022
TGENUYM1XXX;MINISTERIO DE ECONOMIA Y FINANZAS;COLONIA 1089  MONTEVIDEO, MONTEVIDEO, 11100
TIRBALTRXXX;TIRANA BANK;IBRAHIM RUGOVA STR  TIRANA, TIRANA, 1019
TPFSUYM1XXX;TPCG FINANCIAL SERVICES AGENTE DE VALORES S.A.;RUTA 8 17500 EDIFICIO 1, OFICINA 007, ZONAMERICA MONTEVIDEO, MONTEVIDEO, 91600
TRELLV22XXX;TREASURY OF THE REPUBLIC OF LATVIA, THE;SMILSU STREET 1  RIGA, RIGA, LV-1919
TROBCLR1XXX;CREDICORP CAPITAL ASSET MANAGEMENT S.A.ADMINISTRADORA GENERAL DE FONDO;AV APOQUINDO 3721, FLOOR 16 TORRE LAS CONDES - SANTIAGO, PROVINCIA DE SANTIAGO, 8320000
UAFAUYM1XXX;UNION-CAPITAL A.F.A.P.S.A.;SAN JOSE 1104  MONTEVIDEO, MONTEVIDEO, 11100
UBBSBGSFXXX;UNITED BULGARIAN BANK AD;VITOSHA BLVD 89B MILLENNIUM CENTER SOFIA, SOFIA, 1463
UBSWMCMXXXX;UBS (MONACO) S.A.;BRETAGNE 2 AVENUE DE GRANDE MONACO, MONACO, 98007
UNALALTRXXX;UNION BANK SH.A.;FLOOR 13 BULVARDI ZOGU I, KATESH PERBALLE STACIONIT TE TRENIT TIRANA, TIRANA, 1016
UNCRBGSF031;UNICREDIT BULBANK AD;MARIA LOUISA BLVD 2  SOFIA, SOFIA, 1558
UNCRBGSF081;UNICREDIT BULBANK AD;  
UNCRBGSF426;UNICREDIT BULBANK AD;MAKEDONIJA STREET 41  SOFIA, SOFIA, 1000
UNCRBGSF720;UNICREDIT BULBANK AD;VAZRAZHDANE BOULEVRD 37  PLOVDIV, PLOVDIV, 4018
UNCRBGSF733;UNICREDIT BULBANK AD;DR. PUSKIULEV STREET 1  VARNA, VARNA, 9000
UNCRBGSFXXX;UNICREDIT BULBANK AD;SVETA NEDELYA SQUARE 7  SOFIA, SOFIA, 1000
UNLALV2XXXX;SEB BANKA;SEB FINANCE CENTER MEISTARU 1, VALDLAUCI, KEKAVAS PAG RIGA, RIGA, LV-1076
UPSAPLP1XXX;PEKAO INVESTMENT BANKING S.A.;WARSAW FINANCIAL CENTER EMILII PLATER 53 WARSZAWA, MAZOWIECKIE, 00-113
USALALTRXXX;INTESA SANPAOLO BANK ALBANIA SH.A.;RRUGA ISMAIL QEMALI 27  TIRANA, TIRANA, 1001
USINPLP1XXX;ARCELORMITTAL POLAND SPOLKA AKCYJNA;UL. CHORZOWSKA 50  KATOWICE, SLASKIE, 40-121
VAFMMTM1XXX;BOV ASSET MANAGEMENT LIMITED;FLOOR 6, THE MALL  FLORIANA, IL-FURJANA, FRN 1470
VALLMTMTXXX;BANK OF VALLETTA P.L.C.;BOV CENTRE TRIQ IL-KANUN,, ZONE 4 CENTRAL BUSINESS DISTRICT - SANTA VENERA, SANTA VENERA, CBD 4060
VARLUYM1XXX;VARLIX S.A.;MISIONES 1428  MONTEVIDEO, MONTEVIDEO, 11000
VENUMCMCXXX;VENUS MANAGEMENT COMPANY S.A.M.;VILLA BIJOU 19 AVENUE DE LA COSTA MONACO, MONACO, 98000
VOCBMTMTXXX;NOVUM BANK LTD;FLOOR 2, THE EMPORIUM C DE BROCKTORFF STREET MSIDA, MSIDA, MSD 1421
VOWAPLP1XXX;VOLKSWAGEN BANK GMBH SP.Z O.O. ODDZIAL W POLSCE;RONDO ONZ 1  WARSZAWA, MAZOWIECKIE, 00-124
WASWPLP1XXX;BANK SPOLDZIELCZY W WASEWIE;ZASTAWSKA 8  WASEWO, MAZOWIECKIE, 07-311
WBKPPLPPCBM;SANTANDER BANK POLSKA S.A. (FORMERLY BANK ZACHODNI WBK S.A.);PLAC WOLNOSCI 15  POZNAN, WIELKOPOLSKIE, 60-967
WBKPPLPPXXX;SANTANDER BANK POLSKA S.A. (FORMERLY BANK ZACHODNI WBK S.A.);AL. JANA PAWLA II 17  WARSZAWA, MAZOWIECKIE, 00-854
WCFSPLP1XXX;WOOD AND COMPANY FINANCIAL SERVICES A.S. POLISH BRANCH;BUDYNEK SKYLIGHT ZLOTE TARASY UL. ZLOTA 59 WARSZAWA, MAZOWIECKIE, 00-120
XBULBGS1XXX;BULGARIAN STOCK EXCHANGE;TRI USHI STREET 10 FLOOR 12 SOFIA, SOFIA, 1000
XMALMTMTXXX;MALTA STOCK EXCHANGE;GARRISON CHAPEL CASTILE PLACE VALLETTA, VALLETTA, VLT 1063
XMNTUYM1XXX;BOLSA DE VALORES DE MONTEVIDEO S.A.;MISIONES 1400  MONTEVIDEO, MONTEVIDEO, 11000
XRISLV21XXX;AKCIJU SABIEDRIBA NASDAQ RIGA;RIGA STOCK EXCHANGE DOMA LAUKUMS 6 RIGA, RIGA, LV-1885
XSGOCLR1XXX;BOLSA DE SANTIAGO;  
XWARPLP1XXX;GIELDA PAPIEROW WARTOSCIOWYCH W WARSZAWIE SPOLKA AKCYJNA;NOWY SWIAT 6/12  WARSZAWA, MAZOWIECKIE, 00-400
ZETMMTM1XXX;ZFP EQUITY TRADING (MALTA) LIMITED;FLOOR 5, REGENT HOUSE 52 BISAZZA STREET SLIEMA, SLIEMA, SLM 1641
ZIPIPLP1XXX;BANK SPOLDZIELCZY ZIEMI PIOTRKOWSKIEJ;MICKIEWICZA 1  - PIOTRKOW TRYBUNALSKI, LODZKIE, 97-300 
ZUSPPLP1XXX;ZULAWSKI BANK SPOLDZIELCZY;SIKORSKIEGO 52  - NOWY DWOR GDANSKI, POMORSKIE, 82-100 
LLBBLV2XXXX;SIGNET BANK AS;ANTONIJAS 3  RIGA, RIGA, LV-1010
PODSPLA1XXX;PODKARPACKI BANK SPOLDZIELCZY;MICKIEWICZA 7  SANOK, PODKARPACKIE, 38-500
BACAMCMCXXX;ANDBANC MONACO SAM;1 AVENUE DES CITRONNIERS  MONACO, MONACO, 98000
BDCCAWAWXXX;BANCO DI CARIBE (ARUBA) N.V;VONDELLAAN 31  - ORANJESTAD ORANJESTAD-WEST AND ORANJESTAD-EAST 
FCMFMTMTXXX;FCM BANK LIMITED;SUITE 3, TOWER BUSINESS CENTRE TOWER STREET SWATAR, SWATAR, BKR 4013
GCBMCLR1XXX;GBM CORREDORES DE BOLSA LIMITADA;  
HAVLMCMXBDF;BANQUE HAVILLAND (MONACO) S.A.M.;  MONACO, MONACO, 98000
HAVLMCMXXXX;BANQUE HAVILLAND (MONACO) S.A.M.;3-7 BOULEVARD DES MOULINS  MONACO, MONACO, 98000
KCCPPLPWXXX;KDPW CCP;KSIAZECA 4  WARSZAWA, MAZOWIECKIE, 00-498
MOCBCLR1XXX;J.P. MORGAN CORREDORES DE BOLSA SPA;MARIANO SANCHEZ FONTECILLA 310 BIRMANN - SANTIAGO, PROVINCIA DE SANTIAGO, 7550296
NBPLPLPAXXX;NARODOWY BANK POLSKI;UL. SWIETOKRZYSKA 11/21  WARSZAWA, MAZOWIECKIE, 00-919
OKOYLV2XXXX;OP CORPORATE BANK PLC LATVIA BRANCH;MUITAS IELA 1  RIGA, RIGA, LV-1010
TGBPMTMTXXX;CONVERA MALTA FINANCIAL LIMITED;FLOOR 5, W BUSINESS CENTRE 1 TRIQ DUN KARM BIRKIRKARA, BIRKIRKARA, BKR 9033
TPROLV22XXX;SIA TRANSACT PRO;KR. VALDEMARA 62  RIGA, RIGA, LV-1013
TRTEMTM1XXX;TRADEXEC (TEX) LIMITED;VALLETTA BUILDINGS SOUTH STREET VALLETTA, VALLETTA, VLT 1103
CBCUUYMDXXX;BANCO CENTRAL DEL URUGUAY;FABINI 777  MONTEVIDEO, MONTEVIDEO, 11000
HOCVMTM1XXX;HOGG CAPITAL INVESTMENTS LIMITED;REGENT HOUSE 33 BISAZZA STREET SLIEMA, SLIEMA, SLM 1641
TOBAPLPWXXX;TOYOTA BANK POLSKA S.A.;ORION POSTEPU 18B, FLOOR 3 WARSZAWA, MAZOWIECKIE, 02-676
CMCIMCM1BEC;CM-CIC MONACO;8 RUE GRIMALDI  MONACO, MONACO, 98000
NBPLPLPDDSP;NARODOWY BANK POLSKI;  WARSZAWA, MAZOWIECKIE
BONPPLP9XXX;BONDSPOT S.A.;KSIAZECA 4  WARSZAWA, MAZOWIECKIE, 00-498
HSBCPLPSXXX;HSBC CONTINENTAL EUROPE (SA) ODDZIAL W POLSCE;RONDO ONZ 1  WARSZAWA, MAZOWIECKIE, 00-124
AGRIPLPRXXX;CREDIT AGRICOLE BANK POLSKA S.A.;UL. LEGNICKA 48 C-D  WROCLAW, DOLNOSLASKIE, 54-202
BKCHPLPXXXX;BANK OF CHINA (EUROPE) S.A. POLAND BRANCH;UL.ZIELNA 41/43  WARSZAWA, MAZOWIECKIE, 00-108
FBPLPLPWXXX;CA AUTO BANK SPA SPOLKA AKCYJNA ODDZIAL W POLSCE;AL. WYSCIGOWA 6  WARSZAWA, MAZOWIECKIE, 02-681
ICBKPLPWXXX;ICBC POLAND BRANCH;PLAC TRZECH KRZYZY 18  WARSZAWA, MAZOWIECKIE, 00-499
KCCPPLPWOTC;KDPW CCP;  WARSZAWA, MAZOWIECKIE
SCFBPLPWXXX;SANTANDER CONSUMER BANK SA;LEGNICKA 48 B  WROCLAW, DOLNOSLASKIE, 54-202
BCECCLRDXXX;BANCO CENTRAL DE CHILE;  
SYSPMTM1XXX;SYSPAY LIMITED;54 SIR LUIGI CAMILLERI STREET  SLIEMA, SLIEMA, SLM 1840
BCECCLA1XXX;BANCO CENTRAL DE CHILE;  
BCITPLPWXXX;INTESA SANPAOLO SPA;CENTRUM GIELDOWE, TOWER C UL. KSIAZECA 4, FLOOR 5 WARSZAWA, MAZOWIECKIE, 00-498
CGPMMCM1XXX;CGM-AZIMUT MONACO;ESCALIERS DES FLEURS 8 BLD DES MOULINS MONACO, MONACO, 98000
DOIXPLP1XXX;DOM INWESTYCYJNY XELION SP. Z O.O.;PULAWSKA 107  WARSZAWA, MAZOWIECKIE, 02-595
CBEUUYMMXXX;EUROCAM SA;18 DE JULIO 1497  MONTEVIDEO, MONTEVIDEO, 11200
AZFMMCMCXXX;CGM-AZIMUT MONACO;ESCALIER DES FLEURS 8 BOULEVARD DES MOULINS MONACO, MONACO, 98000
BEFNBGS1XXX;BENCHMARK FINANCE;VISKIAR PLANINA 19 FLOOR 2 SOFIA, SOFIA, 1407
BUAABGS1XXX;BULBROKERS EAD;SHEINOVO STR 7  SOFIA, SOFIA, 1504
CAMJBGS1XXX;CAPITAL MARKETS JSC;HRISTO BELCHEV STR 8  SOFIA, SOFIA, 1000
CPNMBGS1XXX;CAPMAN INC.;TRI USHI 8  SOFIA, SOFIA, 1000
DETTBGS1XXX;DELTASTOCK AD;KORAB PLANINA 6 MEGAPARK SOFIA, SOFIA, 1407
DIFKBGS1XXX;DILINGOVA FINANSOVA KOMPANIA AD;TZAR ASSEN STR 7  SOFIA, SOFIA, 1000
DISJBGS1XXX;MK BROKERS AD;TSAR OSVOBODITEL BLVD 8 FLOOR 4 SOFIA, SOFIA, 1000
FALSBGS1XXX;IP FAVORIT CLS;ANGEL KANCHEV STR 25  SOFIA, SOFIA, 1000
FPIJBGS1XXX;FOCAL POINT INVESTMENTS JSC;CHERNI VRUH BLVD  SOFIA, SOFIA, 1407
INMKBGS1XXX;IP INTERCAPITAL MARKETS AD;DOBRUDJA 6  SOFIA, SOFIA, 1000
KAOLBGS1XXX;KAROLL;ZLATOVRAH 1  SOFIA, SOFIA, 1164
MAJSBG21XXX;UG MARKET JSC;VASIL APRILOV STR 92  PLOVDIV, PLOVDIV, 4000
MCBBCLR1XXX;MONEDA CORREDORES DE BOLSA DE BOLSA LIMITADA;  
NODABGS1XXX;DE NOVO EAD;HRISTO BELCHEV 28  SOFIA, SOFIA, 1000
REIABG21XXX;REAL FINANCE JSC;ST. CONSTANTINE AND HELENA ADMINISTRATIVE BUILDING VARNA, VARNA, 9000
SOFKBG21XXX;SOMONI FINANCIAL BROKERAGE LTD.;TZAR SIMEON VELKI BLVD 112  STARA ZAGORA, STARA ZAGORA, 6000
SOIUBGS1XXX;SOFIA INTERNATIONAL SECURITIES AD;NIKOLAY HAYTOV 3A ESTE BUILDING SOFIA, SOFIA, 1113
TBIBBGSFXXX;TBI BANK EAD;DIMITAR HADJIKOCEV STR 52-54  SOFIA, SOFIA, 1421
